{"attempts":1,"base_id":"77852ce86a3287824549f9e0052595395167dd3513997efef43a7c4355c42136","connected_group_count":177,"dataset_version":"b28b8d7c6664dbe400874069606ba7662917dac6bade37f414cde490a00115bf","eligible_group_count":177,"limits":{"attempts":200,"placement_nodes":5000,"proof_nodes":10000},"previous":{"date":"2026-10-31","qids":["Q107387899","Q23004252","Q28025953","Q62067345","Q65269682"],"state":"played"},"puzzle":{"audited_group_count":555,"cells":[{"answer":"5","col":0,"row":0},{"answer":"U","col":0,"row":1},{"answer":"R","col":0,"row":2},{"answer":"P","col":0,"row":3},{"answer":"2","col":3,"row":3},{"answer":"R","col":0,"row":4},{"answer":"N","col":3,"row":4},{"answer":"I","col":0,"row":5},{"answer":"D","col":1,"row":5},{"answer":"L","col":2,"row":5},{"answer":"E","col":3,"row":5},{"answer":"S","col":0,"row":6},{"answer":"1","col":3,"row":6},{"answer":"E","col":0,"row":7}],"cols":4,"entries":[{"aliases":["5urpr!se","5urprise","Surprise","서프라이즈"],"answer":"5URPRISE","canonical_name":"5urprise","clue":{"en":"Group with documented membership of Seo Kang-jun.","pt-BR":"Grupo com participação documentada de Seo Kang-jun."},"col":0,"direction":"down","matching_qids":["Q16935427"],"number":1,"qid":"Q16935427","row":0,"sources":[{"locator":"wikipedia:en:pageid=42830743:revid=1379961437#extract[128:141]","predicate":"has_member","snippet":"5urprise (Korean: 서프라이즈; pronounced surprise), was the first ever South Korean actor group and consists of five actors: Yoo Il, Seo Kang-joon, Gong Myung, Kang Tae-oh and Lee Tae-hwan.","statement_id":"Q16935427$ac345399-43ac-7f2d-6954-99570eb68c56","url":"https://en.wikipedia.org/w/index.php?curid=42830743&oldid=1379961437","value":"Seo Kang-jun"}]},{"aliases":["21New Evolution","2NE1","2New Evolution1","To Anyone","투애니원"],"answer":"2NE1","canonical_name":"2NE1","clue":{"en":"Group formed in 2009. Documented record label: YG Entertainment.","pt-BR":"Grupo formado em 2009. Gravadora documentada: YG Entertainment."},"col":3,"direction":"down","matching_qids":["Q171885"],"number":2,"qid":"Q171885","row":3,"sources":[{"locator":"wikipedia:en:pageid=22711766:revid=1381378698#extract[121:125]","predicate":"formed_on","snippet":"2NE1 (Korean: 투애니원; RR: Tuaeniwon; pronounced [tʰu.ɛ.ni.wʌn]) is a South Korean girl group formed by YG Entertainment in 2009.","statement_id":"Q171885$1357D6A8-14D5-46D9-8067-BAC416C505E4","url":"https://en.wikipedia.org/w/index.php?curid=22711766&oldid=1381378698","value":"2009"},{"locator":"wikipedia:en:pageid=22711766:revid=1381378698#wikitext[613:636]","predicate":"record_label","snippet":"label = [[YG Entertainment|YG]]","statement_id":"Q171885$50909549-B72B-4EB6-821E-D54C474194A9","url":"https://en.wikipedia.org/w/index.php?curid=22711766&oldid=1381378698","value":"YG Entertainment"}]},{"aliases":["(G)I-DLE","(여자)아이들","I-dle","i-dle","아이들"],"answer":"IDLE","canonical_name":"I-dle","clue":{"en":"Group with documented membership of Minnie.","pt-BR":"Grupo com participação documentada de Minnie."},"col":0,"direction":"across","matching_qids":["Q51885404"],"number":3,"qid":"Q51885404","row":5,"sources":[{"locator":"wikipedia:en:pageid=57057212:revid=1381301828#extract[212:218]","predicate":"has_member","snippet":"The group consists of five members: Miyeon, Minnie, Soyeon, Yuqi, and Shuhua.","statement_id":"Q51885404$d1241c04-416f-289f-03a9-bfc0452a7476","url":"https://en.wikipedia.org/w/index.php?curid=57057212&oldid=1381301828","value":"Minnie"}]}],"proof":{"complete":true,"nodes":4,"solutions":1},"rows":8,"vocabulary":["Q16935427","Q171885","Q51885404"]},"reference_date":"2026-11-01","rejections":{},"schema_version":"crossword-daily-v1","seed":"kpop-crossword-daily","status":"ready"}
